{
  "$schema": "https://json-schema.org/draft/2020-12/schema",
  "type": "object",
  "required": [
    "schema",
    "target",
    "status",
    "sha",
    "dirty",
    "tree_sha256",
    "toolchain_digest",
    "versions_lock_sha256",
    "parallel",
    "started",
    "finished",
    "checks",
    "csp",
    "budgets",
    "artifacts"
  ],
  "properties": {
    "schema": {
      "const": 1
    },
    "target": {
      "type": "string",
      "minLength": 1
    },
    "status": {
      "enum": [
        "pass",
        "fail"
      ]
    },
    "sha": {
      "type": "string",
      "pattern": "^[0-9a-f]{40}([0-9a-f]{24})?$"
    },
    "dirty": {
      "type": "boolean"
    },
    "tree_sha256": {
      "$ref": "#/$defs/hash"
    },
    "toolchain_digest": {
      "type": "string",
      "pattern": "^sha256:[0-9a-f]{64}$"
    },
    "versions_lock_sha256": {
      "$ref": "#/$defs/hash"
    },
    "parallel": {
      "type": "integer",
      "minimum": 1,
      "maximum": 4
    },
    "started": {
      "type": "string",
      "pattern": "^\\d{4}-\\d{2}-\\d{2}T\\d{2}:\\d{2}:\\d{2}(\\.\\d{3})?Z$"
    },
    "finished": {
      "type": "string",
      "pattern": "^\\d{4}-\\d{2}-\\d{2}T\\d{2}:\\d{2}:\\d{2}(\\.\\d{3})?Z$"
    },
    "checks": {
      "type": "array",
      "minItems": 1,
      "items": {
        "type": "object",
        "required": [
          "name",
          "status",
          "duration_ms"
        ],
        "properties": {
          "name": {
            "type": "string",
            "minLength": 1
          },
          "status": {
            "enum": [
              "pass",
              "fail",
              "skipped"
            ]
          },
          "reason": {
            "type": "string"
          },
          "duration_ms": {
            "type": "integer",
            "minimum": 0
          }
        },
        "additionalProperties": false
      }
    },
    "csp": {
      "type": "object",
      "required": [
        "stage",
        "violations",
        "legacy_violations"
      ],
      "properties": {
        "stage": {
          "enum": [
            "report-only",
            "enforced"
          ]
        },
        "violations": {
          "type": "integer",
          "minimum": 0
        },
        "legacy_violations": {
          "type": "integer",
          "minimum": 0
        }
      },
      "additionalProperties": false
    },
    "budgets": {
      "type": "object",
      "additionalProperties": {
        "type": "object",
        "required": [
          "limit",
          "actual",
          "status"
        ],
        "properties": {
          "limit": {
            "type": [
              "integer",
              "null"
            ],
            "minimum": 0
          },
          "actual": {
            "type": "integer",
            "minimum": 0
          },
          "status": {
            "enum": [
              "pass",
              "fail",
              "recorded"
            ]
          }
        },
        "additionalProperties": true
      }
    },
    "artifacts": {
      "type": "array",
      "items": {
        "type": "string",
        "pattern": "^.+ sha256:[0-9a-f]{64}$"
      }
    },
    "legacy_pending": {
      "type": "array",
      "items": {
        "type": "object",
        "required": [
          "rule",
          "tool_or_import",
          "paths",
          "expires",
          "source"
        ],
        "properties": {
          "rule": {
            "enum": [
              "banned-imports",
              "banned-packages",
              "compat-paths"
            ]
          },
          "tool_or_import": {
            "type": "string",
            "minLength": 1
          },
          "paths": {
            "type": "array",
            "minItems": 1,
            "items": {
              "type": "string",
              "minLength": 1
            }
          },
          "expires": {
            "type": "string",
            "minLength": 1
          },
          "source": {
            "const": "lint/scope.json"
          }
        },
        "additionalProperties": false
      }
    },
    "ui_adoption": {
      "$ref": "#/$defs/ui_adoption"
    }
  },
  "additionalProperties": false,
  "$defs": {
    "hash": {
      "type": "string",
      "pattern": "^[0-9a-f]{64}$"
    },
    "ui_adoption": {
      "type": "object",
      "required": [
        "mode",
        "status",
        "until",
        "source",
        "config_sha256",
        "legacy",
        "selected_ui"
      ],
      "properties": {
        "mode": {
          "const": "staged-react"
        },
        "status": {
          "const": "pending"
        },
        "until": {
          "const": "S1-M2"
        },
        "source": {
          "const": "repo:kit-config"
        },
        "config_sha256": {
          "type": "string",
          "pattern": "^[0-9a-f]{64}$"
        },
        "legacy": {
          "type": "object",
          "required": [
            "version",
            "archive_sha256",
            "source_sha",
            "receipt",
            "receipt_sha256"
          ],
          "properties": {
            "version": {
              "const": "0.3.0"
            },
            "archive_sha256": {
              "type": "string",
              "pattern": "^[0-9a-f]{64}$"
            },
            "source_sha": {
              "type": "string",
              "pattern": "^[0-9a-f]{40}([0-9a-f]{24})?$"
            },
            "receipt": {
              "type": "string",
              "pattern": "^(?!.*(?:^|/)(?:kit|node_modules|third_party|vendor|dist|embedfs|test-results|TASK_BRIEF\\.md|TASK_RESULT\\.md|SWARM_RESULT\\.md)(?:/|$))(?!.*\\.tsbuildinfo(?:\\.(?:gz|br))?$)[A-Za-z0-9_@-][A-Za-z0-9_@.-]*(?:/[A-Za-z0-9_@-][A-Za-z0-9_@.-]*)*$"
            },
            "receipt_sha256": {
              "type": "string",
              "pattern": "^[0-9a-f]{64}$"
            }
          },
          "additionalProperties": false
        },
        "selected_ui": {
          "type": "object",
          "required": [
            "version",
            "archive_sha256"
          ],
          "properties": {
            "version": {
              "type": "string",
              "pattern": "^[0-9]+\\.[0-9]+\\.[0-9]+$"
            },
            "archive_sha256": {
              "type": "string",
              "pattern": "^[0-9a-f]{64}$"
            }
          },
          "additionalProperties": false
        }
      },
      "additionalProperties": false
    }
  }
}
