{
  "schema": 1,
  "target": "gen",
  "status": "pass",
  "sha": "c40fc14ed562b02baf22bcc5dc593e40457ecdb6",
  "dirty": false,
  "tree_sha256": "fb63aadd437ef40b6d68472307f056523e6303d092e078b3474fa0b3ecd41a9f",
  "toolchain_digest": "sha256:2e040a5165d79be63755424f707fdb8cf609ace831ada7a9baca398ac25e12b9",
  "versions_lock_sha256": "7ce6c385dde548aba1fc821f557179ef0fdb8d0b8147f1847bdd267e041100be",
  "parallel": 2,
  "started": "2026-10-09T02:34:22.405Z",
  "finished": "2026-10-09T03:22:59.054Z",
  "checks": [
    {
      "name": "bootstrap-evidence",
      "status": "pass",
      "duration_ms": 2
    },
    {
      "name": "ui-adoption",
      "status": "pass",
      "reason": "ui-staged-pending",
      "duration_ms": 78
    },
    {
      "name": "cat-gen-request",
      "status": "pass",
      "duration_ms": 0
    },
    {
      "name": "cat-normalized-npm-ci",
      "status": "pass",
      "duration_ms": 4030
    },
    {
      "name": "cat-normalized-bundle-contract",
      "status": "pass",
      "duration_ms": 204
    },
    {
      "name": "cat-normalized-sdk-allocation-audit",
      "status": "pass",
      "duration_ms": 591
    },
    {
      "name": "cat-normalized-native-types",
      "status": "pass",
      "duration_ms": 1754
    },
    {
      "name": "cat-normalized-frontend-lint",
      "status": "pass",
      "duration_ms": 7268
    },
    {
      "name": "cat-normalized-api-consumer-contract",
      "status": "pass",
      "duration_ms": 1181
    },
    {
      "name": "cat-normalized-selection-key-contract",
      "status": "pass",
      "duration_ms": 759
    },
    {
      "name": "cat-normalized-fresh-build-output",
      "status": "pass",
      "duration_ms": 148
    },
    {
      "name": "cat-doccheck-source-contracts",
      "status": "pass",
      "duration_ms": 3066
    },
    {
      "name": "cat-native-source-contracts",
      "status": "pass",
      "duration_ms": 23579
    },
    {
      "name": "cat-native-source-format",
      "status": "pass",
      "duration_ms": 187
    },
    {
      "name": "cat-normalized-doc-check",
      "status": "pass",
      "duration_ms": 593
    },
    {
      "name": "cat-normalized-frontend-build",
      "status": "pass",
      "duration_ms": 4829
    },
    {
      "name": "cat-normalized-emitted-inventory",
      "status": "pass",
      "duration_ms": 124
    },
    {
      "name": "cat-normalized-startup-measurement",
      "status": "pass",
      "duration_ms": 100
    },
    {
      "name": "cat-normalized-assets-sync",
      "status": "pass",
      "duration_ms": 148
    },
    {
      "name": "cat-normalized-gui-identity",
      "status": "pass",
      "duration_ms": 175
    },
    {
      "name": "cat-normalized-build-cat-server",
      "status": "pass",
      "duration_ms": 2837
    },
    {
      "name": "cat-normalized-build-cat-browser-plan",
      "status": "pass",
      "duration_ms": 1370
    },
    {
      "name": "cat-normalized-backend-race",
      "status": "pass",
      "duration_ms": 844436
    },
    {
      "name": "cat-normalized-backend-vet",
      "status": "pass",
      "duration_ms": 596
    },
    {
      "name": "cat-normalized-authcore-race",
      "status": "pass",
      "duration_ms": 10304
    },
    {
      "name": "cat-normalized-authcore-vet",
      "status": "pass",
      "duration_ms": 78
    },
    {
      "name": "cat-normalized-sealed-react-runtime",
      "status": "pass",
      "duration_ms": 61954
    },
    {
      "name": "cat-normalized-complete-browser",
      "status": "pass",
      "duration_ms": 1944420
    },
    {
      "name": "ui-adoption-binding",
      "status": "pass",
      "duration_ms": 1
    }
  ],
  "csp": {
    "stage": "report-only",
    "violations": 0,
    "legacy_violations": 0
  },
  "budgets": {},
  "artifacts": [
    ".gate/gen/logs/92604304-c72d-4f79-bdcf-bd3316525662-bootstrap-config-0.stdout.log sha256:557b4a0935c07456dd43460c45e65ee3bf5f2931d97ea308138f4a8e56457b95",
    ".gate/gen/logs/92604304-c72d-4f79-bdcf-bd3316525662-bootstrap-config-0.stderr.log sha256:e3b0c44298fc1c149afbf4c8996fb92427ae41e4649b934ca495991b7852b855",
    ".gate/gen/logs/92604304-c72d-4f79-bdcf-bd3316525662-bootstrap-config-1.stdout.log sha256:557b4a0935c07456dd43460c45e65ee3bf5f2931d97ea308138f4a8e56457b95",
    ".gate/gen/logs/92604304-c72d-4f79-bdcf-bd3316525662-bootstrap-config-1.stderr.log sha256:e3b0c44298fc1c149afbf4c8996fb92427ae41e4649b934ca495991b7852b855",
    ".gate/gen/bootstrap-execution.json sha256:239cf64db313f75587edc9d3d09702776b8eea8e834cf95bc38fe6347598b909",
    ".gate/gen/ui-adoption-evidence.json sha256:60313d4b317d5c6a39ded2de95b84d1600b184733dd41e73fa430b95bd5d252e",
    ".gate/gen/logs/92604304-c72d-4f79-bdcf-bd3316525662-repo-gen-10.stdout.log sha256:81e68744fbb2fb2df2f862d63e78a61ea30bc3571dbb40871a1ffec0405b5fae",
    ".gate/gen/logs/92604304-c72d-4f79-bdcf-bd3316525662-repo-gen-10.stderr.log sha256:05cfec0ae47531b73451eb67ffc91de3d6f55f54435a8a042c85582c33969662",
    ".gate/gen/logs/92604304-c72d-4f79-bdcf-bd3316525662-cat-normalized-npm-ci-1.stdout.log sha256:88b09df655b4c750461f6ebc75cfdbae4f2e078768692e8a0b532eea986d8f6f",
    ".gate/gen/logs/92604304-c72d-4f79-bdcf-bd3316525662-cat-normalized-npm-ci-1.stderr.log sha256:c211d12fa3e2f4c92b2151c523b2743bc220c1991e0de3797724e244bb411568",
    ".gate/gen/logs/92604304-c72d-4f79-bdcf-bd3316525662-cat-normalized-bundle-contract-2.stdout.log sha256:079d4a34eee51ca685d23ea561e0978b77b7a795fad33754769c7d3317c7aa6a",
    ".gate/gen/logs/92604304-c72d-4f79-bdcf-bd3316525662-cat-normalized-bundle-contract-2.stderr.log sha256:e3b0c44298fc1c149afbf4c8996fb92427ae41e4649b934ca495991b7852b855",
    ".gate/gen/logs/92604304-c72d-4f79-bdcf-bd3316525662-cat-normalized-sdk-allocation-audit-4.stdout.log sha256:63d2c6fba45353f2040f702aa78024057cb8f7364dcd33ffd8f87f6f4b0f7934",
    ".gate/gen/logs/92604304-c72d-4f79-bdcf-bd3316525662-cat-normalized-sdk-allocation-audit-4.stderr.log sha256:e3b0c44298fc1c149afbf4c8996fb92427ae41e4649b934ca495991b7852b855",
    ".gate/gen/logs/92604304-c72d-4f79-bdcf-bd3316525662-cat-normalized-native-types-5.stdout.log sha256:e3b0c44298fc1c149afbf4c8996fb92427ae41e4649b934ca495991b7852b855",
    ".gate/gen/logs/92604304-c72d-4f79-bdcf-bd3316525662-cat-normalized-native-types-5.stderr.log sha256:f29bc3e1fe96d9bdaf4bfff3ac9fac2885480c4241d841bac8546290fd3a04b6",
    ".gate/gen/logs/92604304-c72d-4f79-bdcf-bd3316525662-cat-normalized-frontend-lint-6.stdout.log sha256:fafe71881dc141ef0721c508f2222518192d198a832af8eff251e6f60f57909d",
    ".gate/gen/logs/92604304-c72d-4f79-bdcf-bd3316525662-cat-normalized-frontend-lint-6.stderr.log sha256:1eb4d4edd1dea351bf79376ca04aed03c1185809b8622433370fad189408e8ed",
    ".gate/gen/logs/92604304-c72d-4f79-bdcf-bd3316525662-cat-normalized-api-consumer-contract-7.stdout.log sha256:f34cad8935965c33928fa44e8a92a6de934dd0ed44e558ca736843f40beb35c1",
    ".gate/gen/logs/92604304-c72d-4f79-bdcf-bd3316525662-cat-normalized-api-consumer-contract-7.stderr.log sha256:e3b0c44298fc1c149afbf4c8996fb92427ae41e4649b934ca495991b7852b855",
    ".gate/gen/logs/92604304-c72d-4f79-bdcf-bd3316525662-cat-normalized-selection-key-contract-9.stdout.log sha256:0b46a6b5facfeab041db2a79aeff71af4567d834a58ea33b1ef28a2b21cd4b4e",
    ".gate/gen/logs/92604304-c72d-4f79-bdcf-bd3316525662-cat-normalized-selection-key-contract-9.stderr.log sha256:e3b0c44298fc1c149afbf4c8996fb92427ae41e4649b934ca495991b7852b855",
    ".gate/gen/logs/92604304-c72d-4f79-bdcf-bd3316525662-cat-normalized-fresh-build-output-11.stdout.log sha256:95033868a6611804b84899fc477c889f87437a5b2e482996cc0dadaeb3e83d95",
    ".gate/gen/logs/92604304-c72d-4f79-bdcf-bd3316525662-cat-normalized-fresh-build-output-11.stderr.log sha256:e3b0c44298fc1c149afbf4c8996fb92427ae41e4649b934ca495991b7852b855",
    ".gate/gen/logs/92604304-c72d-4f79-bdcf-bd3316525662-cat-doccheck-source-contracts-13.stdout.log sha256:90723149724500f553395cf143a1cebc65f597631e13d9a83ad5b93b18fd8e69",
    ".gate/gen/logs/92604304-c72d-4f79-bdcf-bd3316525662-cat-doccheck-source-contracts-13.stderr.log sha256:e3b0c44298fc1c149afbf4c8996fb92427ae41e4649b934ca495991b7852b855",
    ".gate/gen/doccheck-contracts/report.json sha256:79a69ac09b1d50685a081959804e56fd6f361aee3151831df69bd3bdd557942b",
    ".gate/gen/logs/92604304-c72d-4f79-bdcf-bd3316525662-cat-native-source-contracts-17.stdout.log sha256:a3768342b7bf344cc6bf4fdddb122232ad30bd0357f2d7e209b362f99eb77bf2",
    ".gate/gen/logs/92604304-c72d-4f79-bdcf-bd3316525662-cat-native-source-contracts-17.stderr.log sha256:e3b0c44298fc1c149afbf4c8996fb92427ae41e4649b934ca495991b7852b855",
    ".gate/gen/native-contracts/report.json sha256:aa38e41c3643d336b4e54e13ee814812d513e86f6dadb34031ded4582a756d3a",
    ".gate/gen/logs/92604304-c72d-4f79-bdcf-bd3316525662-cat-native-source-format-20.stdout.log sha256:cd46dad0d1d158b0d205256fcc7c70f6d0398f85356bee83dcedb5123c68a611",
    ".gate/gen/logs/92604304-c72d-4f79-bdcf-bd3316525662-cat-native-source-format-20.stderr.log sha256:e3b0c44298fc1c149afbf4c8996fb92427ae41e4649b934ca495991b7852b855",
    ".gate/gen/native-format/go-backend/cmd/cat-gui-build/main.go sha256:cd46dad0d1d158b0d205256fcc7c70f6d0398f85356bee83dcedb5123c68a611",
    ".gate/gen/logs/92604304-c72d-4f79-bdcf-bd3316525662-cat-native-source-format-21.stdout.log sha256:28faf328c01cccdf425177cd8f043c165d984bc6066d40c30720549aac55244a",
    ".gate/gen/logs/92604304-c72d-4f79-bdcf-bd3316525662-cat-native-source-format-21.stderr.log sha256:e3b0c44298fc1c149afbf4c8996fb92427ae41e4649b934ca495991b7852b855",
    ".gate/gen/native-format/go-backend/cmd/cat-server/main.go sha256:28faf328c01cccdf425177cd8f043c165d984bc6066d40c30720549aac55244a",
    ".gate/gen/logs/92604304-c72d-4f79-bdcf-bd3316525662-cat-native-source-format-22.stdout.log sha256:547362711cbdae0825adfae665b4c4b8eb44d11e7b3873f7563d37456f6e99dd",